title,date,source,abstract,href,content
印度男子打造新冠病毒模型车,2020/4/11,小浪同学爱吐槽,近日 一辆新冠病毒造型的车在印度街道上穿梭 这辆车由印度男子苏达卡设计 只可容纳一人 苏达卡说 这么做是为了唤醒人们对病毒的警惕性,https://k.sina.com.cn/article_2060029603_m7ac98ea3033016ht2.html?from=science,近日，一辆新冠病毒造型的车在印度街道上穿梭。这辆车由印度男子苏达卡设计，只可容纳一人。苏达卡说，这么做是为了唤醒人们对病毒的警惕性。特别声明：以上文章内容仅代表作者本人观点，不代表新浪网观点或立场。如有关于作品内容、版权或其它问题请于作品发表后的30日内与新浪网联系。
美军医疗舰“安慰”号上已有3名船员新冠病毒阳性,2020/4/11,环球网,中新网4月11日电 据美媒11日报道 截至目前 停靠在洛杉矶港的美国海军医疗舰“安慰”号上 已有3名船员新冠病毒检测结果呈阳性,https://k.sina.com.cn/article_1686546714_6486a91a020011eqm.html?from=mil,中新网4月11日电 据美媒11日报道，截至目前，停靠在洛杉矶港的美国海军医疗舰“安慰”号上，已有3名船员新冠病毒检测结果呈阳性。据报道，海军方面10日称，“安慰”号上又有2名船员新冠病毒检测呈阳性。此前在8日，公共事务官员证实，该艘医疗舰上的一名工作人员感染新冠病毒。目前，暂不清楚医疗舰船员是如何感染新冠病毒。据悉，医疗舰“安慰”号上接收的患者为未感染新冠病毒的患者，以减轻当地医院的负担。截至8日，仍有12名患者在船上接受治疗。来源：中国新闻网特别声明：以上文章内容仅代表作者本人观点，不代表新浪网观点或立场。如有关于作品内容、版权或其它问题请于作品发表后的30日内与新浪网联系。
停止新冠病毒的污名化！《自然》杂志致歉曾将新冠病毒与武汉关联,2020/4/11,看看新闻KNEWS,停止新冠病毒的污名化！《自然》杂志致歉曾将新冠病毒与武汉关联,https://k.sina.com.cn/article_6145283913_m16e499749020011cvj.html?from=news&subch=onews,特别声明：以上文章内容仅代表作者本人观点，不代表新浪网观点或立场。如有关于作品内容、版权或其它问题请于作品发表后的30日内与新浪网联系。
专访病毒学家金冬雁：新冠疫情防控，下一步怎么走？,2020/4/11,健康报,截至4月10日 全球新冠病毒感染人数已达147万 各国处于疫情防控的不同阶段,https://k.sina.com.cn/article_2011571083_77e6238b02000r7ko.html?from=science,截至4月10日，全球新冠病毒感染人数已达147万，各国处于疫情防控的不同阶段，都在面对不同的问题。美国确诊人数大幅上升；西班牙称已达到流行高峰；中国在实施“外防输入、内防反弹”的策略，在防控常态化条件下加快恢复生产、生活秩序……站在疫情防控的十字路口，下一步怎么走？如何理解疫情防控常态化？无症状感染者怎么找出来？香港大学李嘉诚医学院生物医学学院教授金冬雁接受了《健康报》专访。病毒自身尚存变数，疫苗阻断或是“最优解”目前人类已知的冠状病毒一共有七种。最早发现的两种是HCoV-229E和HCoV-OC43。后来，2003年香港大学的科学家发现SARS-CoV，2012年出现MERS-CoV，香港大学的科学家又发现了HCoV-HKU1，荷兰的科学家发现了HCoV-NL63。“过去冠状病毒不太受重视，长期以来的研究比较少。主要原因是人们认为它们跟鼻病毒一样，只会引起普通感冒，比流感还要弱，比如HCoV-229E和HCoV-OC43。但2003年一场SARS疫情，完全改变了这个观念。SARS-CoV的病死率达到将近10%，MERS-CoV的病死率更达到35%~40%。”金冬雁说。在新冠病毒出现之前，SARS-CoV已销声匿迹，MERS-CoV虽然不断从骆驼传给人，但不能持续人传人。相比之下，其他四种冠状病毒却在人群和社区中常年存在。那么，新冠病毒会在人间消失还是落地生根？金冬雁认为，新冠病毒介于这两种情况之间，因为它兼有这两组病毒的特点，所以未来走向还有待进一步研究、观察。当前研究显示，新冠病毒的传染性更强。美国疾病预防控制中心在《新兴传染病》杂志发表题为《新冠病毒的高传染性和快速传播》的研究论文指出，新冠肺炎R0中位数为5.7，这意味着一名感染者可传播5.7人，这一数据高于其他冠状病毒。论文警告称，各国需意识到，如果防控措施不能尽早和强力地实施，该病毒则有可能迅速传播并感染大部分人，使当地医疗卫生系统不堪重负。但同时，金冬雁也带来好消息：“新冠病毒的致病性比SARS要低，同时，新冠病毒的突变率比SARS-CoV和HIV病毒都要低。目前在意大利、美国、中国分离出的新冠病毒毒株都很像。尽管某些科学家可以人为地将其分成不同的组来追踪其演变及传播路径，但新冠病毒基本上还是不太变化的，不同组之间实际上只有三万分之一或三万分之二的差别。这种情况也是说明，它对人类的适应性可能已经比较强了。”“如果新冠病毒变成季节性，就需要我们进行常态化管理，要把它像严重流感等病毒疾病一样去防控。”金冬雁强调，“但特别要加强重症患者救治，要尽早诊断，阻止疾病进展，就能进一步降低病死率。特别是，我国提出要保护老年人，能够收到好的防控效果。”在金冬雁看来，当前的重中之重是疫苗研发。“通过疫苗可能还有希望可以把它消灭掉。”据悉，世卫组织总干事谭德塞博士在4月8日召开的2019冠状病毒病（COVID-19）疫情媒体通报会上介绍，来自世界各地的130名科学家、资助方和制造商在这一天签署了一份声明，承诺与世卫组织合作，加快开发COVID-19疫苗。加强主动检测，确定实际感染人数最近，德国哥廷根大学Christian Bommer博士和Sebastian Vollmer教授使用了3月30日《柳叶刀・传染病学》的一篇研究论文中的数据估算，全球仅发现6%左右的新冠病毒感染者，全球实际感染人数可能已达几千万。他们认为，世界各国正式发布并由媒体广泛报道的新冠肺炎确诊病例数大大低于真实的感染数，各个国家和地区急需提高发现确诊病例和控制病毒传播的能力。“从检测技术来说，当家手段还是逆转录PCR的核酸检测。在武汉疫情爆发前期，逆转录PCR技术是唯一的核酸诊断检测手段，起了很大的作用。这项技术先由RNA得到互补的DNA，然后再用PCR进行扩增，把一段特定的DNA样本复制百万上亿份，大大提高了检测的准确率。”金冬雁指出，“尽管后来有’复阳’现象出现，但可以说，绝大部分是采样的问题。”“在实际操作环节，通过咽拭子或者肺泡灌洗液获得的样本，进行核酸检测很关键，但采样并不容易。正是由于采样难和其它技术上的问题，2月初我国调整诊断标准，如果患者CT诊断肺磨玻璃影，也可以算作确诊，这样就可以早隔离。此外，IgM和IgG抗体的胶体金及ELISA试剂盒可以对当下和曾经发生的感染进行特异性诊断，找到已获得免疫的人群。”金冬雁介绍。金冬雁认为，当下迫切需要加快研发检测抗原的ELISA试剂，这是与核酸检测高度互补的一种检测方法。“用抗原检测作为初筛，最快10~30分钟就能得到初步结果。如果抗原呈阳性，再进行核酸检测，这种方式能提高检测效率。但前提是，抗原检测的试剂盒质量要过关。”目前，欧盟对快速筛查试剂比较积极，但世界卫生组织仍建议仅用于研究，暂缓用于临床诊断。“要依靠流行病学家开展主动检测，实施’上下结合’的策略。”金冬雁介绍，“上是说，流行病学家去主动寻找高风险人群；下是说，觉得不舒服的人，主动去医院检测。目前，美国、新加坡、韩国等地都在开展主动检测，尽量把无症状感染者找出来。”防控策略应因地制宜，科研储备要持续目前，各个国家都采用了不同的防控策略。“每个国家和地区，其实都要根据自己的特点来制定策略。我觉得这是一个学术问题，是值得探讨的，应该是互相借鉴、学习，而不是互相指责，因为各有优点、缺点，很可能是殊途同归。”金冬雁说。“在疾控、科技等方面有很多的经验、教训需要去吸取。”2003年SARS疫情之后，金冬雁曾在《健康报》刊发文章呼吁：不要吃蝙蝠等野生动物。遗憾的是，病毒走后，陋习死灰复燃。“国家要持续支持创新性的研究工作，重视科研技术力量储备。2003年开展SARS冠状病毒研究的可能有几千人，到后来只有几家坚持下来。事实上，疫情暴发后不久，1月17日香港大学的研究团队很快就明确了新冠病毒的重要传播特征，为防控工作提供了重要依据。这就得益于此前长期的技术储备，以及基础研究与临床工作密切结合的传统。如果在病毒研究方面投资了，将来遇到病毒大流行的时候，损失一定是减少的。”金冬雁说。文：健康报记者 王潇雨特别声明：以上文章内容仅代表作者本人观点，不代表新浪网观点或立场。如有关于作品内容、版权或其它问题请于作品发表后的30日内与新浪网联系。
法国国防部：戴高乐号航母上50名船员新冠病毒检测呈阳性,2020/4/11,辽视说天下,当地时间10日下午 法国国防部发布公告称 “戴高乐”号航母上50名船员新冠病毒检测呈阳性 有3人已于9日上午通过舰载直升机被转移到医院 当地时间8日上午 法国国防部发布公告称,https://k.sina.com.cn/article_1807058715_m6bb5871b03300tkra.html,当地时间10日下午，法国国防部发布公告称，“戴高乐”号航母上50名船员新冠病毒检测呈阳性，有3人已于9日上午通过舰载直升机被转移到医院。当地时间8日上午，法国国防部发布公告称，目前正在大西洋海域执行任务的“戴高乐”号航母上，有40余名海军士兵近期出现新冠肺炎疑似症状并已被隔离。法国国防部于8日当天派出检测人员，携带检测手段登舰对疑似病例进行筛查。特别声明：以上文章内容仅代表作者本人观点，不代表新浪网观点或立场。如有关于作品内容、版权或其它问题请于作品发表后的30日内与新浪网联系。
