title,url,source,date,time,content
美国呼吸机严重短缺，学者提议通过患者获益程度决定优先级,https://news.sina.com.cn/o/2020-04-04/doc-iimxxsth3661008.shtml,澎湃新闻,2020-04-04,21:07:00,　　原标题：美国呼吸机严重短缺，学者提议通过患者获益程度决定优先级　　美国约翰斯·霍普金斯大学发布的最新统计数据显示，截至北京时间4月4日17时43分，美国已累计新冠肺炎确诊病例27.8万例，死亡7159例。该国有限的医疗资源正承载巨大压力。　　据美国有线电视新闻网（CNN）4月3日报道，随着新冠病毒在全美国迅速蔓延，感染高峰仍未到来而医疗物资已经短缺，医院和医生将面临一个艰难抉择：选择谁能获得救命的呼吸机。　　“美国的医生从未遇到这种情况”，“这将（是）极其困难（的决定）”。哈佛医学院生物伦理中心主任罗伯特·特鲁格博士（Dr。 Robert Truog）说到。　　纽约州州长科莫曾在4月2日指出，纽约州的呼吸机“正以火烧般速度”减少，呼吸机库存将在6天内耗尽。据康涅狄格州的一名医生表示，通常情况下成年患者只需在重症监护室（ICU）里靠呼吸机持续三到四天，但新冠肺炎患者使用呼吸机最多需要两到三周。随着新冠肺炎患者大量涌入医院，全国重症监护病房对呼吸机的需求也在激增。　　对此，特鲁格说他整个周末都在帮助医院制定政策，以决定什么人能在公共卫生紧急情况下能够接受重症监护。他说，一个更好的指导框架是由匹兹堡大学和匹兹堡大学医学中心的重症监护医学教授怀特博士（Douglas White）研发的。　　报道称，这个框架本质上是一个积分系统，基于两个因素：1）挽救最多的生命 ；2）挽救最多的寿命年数（life-years），以此来计算患者从ICU护理中获益的可能性，并由此来决定患者护理的优先级。当积分相同时，怀特的指导框架建议医生考虑患者的生命周期，优先考虑年轻患者。　　据此前报道，上述积分系统将重症患者分成了八个等级，分数越低，获得救治的机会越高，但如癌症晚期、失智症、慢性肺病等患者的分数较高，将意味着在物资短缺时他们将较难获得足够的医疗救治。有批评声音认为，上述积分制度在某些极端情况下将决定病人的生死。对此，怀特解释称，这一积分系统是比当前的呼吸机分配方案更公道的。　　怀特表示，他的积分系统旨在包容和避免歧视残疾人，“必须明确的是，没有人会因为残疾而丧失治疗资格”。他通过审查关于分配重症病患护理资源的现有建议，发现这些建议通常基于“排除标准”。“高龄、严重认知障碍、慢性心肺疾病”均被排除在救治范围内，“我认为这是不道德的。排除标准发出了错误的信息，即有些生命不值得被挽救。”　　例如，阿拉巴马州的2010年紧急行动计划称“患有严重的智力障碍”和“中度至重度痴呆”的人“不太可能获得呼吸机支持”。这些指南于2020年2月更新，但新指南没有提及在呼吸机短缺的情况下如何对患者进行分类治疗。阿拉巴马州公共卫生部尚未确认是否仍在使用“排除标准”。　　而怀特的指导框架确保了从一开始就没有人被取消获得重症监护的资格。哈佛大学的特鲁格博士最近在《新英格兰医学杂志》和《波士顿环球报》上发表文章支持了怀特的指导框架，认为这会帮助医院、医生和公众为（特鲁格博士认为）即将面临的决策做好准备。　　怀特认为专家的前瞻性很重要。这样一来，面对大流行，医生们就不用为这些可怕的伦理问题而苦苦挣扎。他还认为，分诊委员会（triage committee）应该由非一线的医生创立，以“增强客观性，避免冲突，并将道德痛苦降到最低”。特鲁格则表示即使有了像怀特提供的框架为伦理指导，但美国医生的未来之路并不平坦。 “很有可能，在未来几天里，医生们将不得不做出他们以前从未考虑过的决定。对一些人来说，这种精神上的打击将会使他们完全丧失能力。”责任编辑：张建利 
美国呼吸机严重短缺，学者提议通过患者获益程度决定优先级,https://mil.news.sina.com.cn/2020-04-04/doc-iimxyqwa5099188.shtml,澎湃新闻,2020-04-04,21:07:00,美国约翰斯·霍普金斯大学发布的最新统计数据显示，截至北京时间4月4日17时43分，美国已累计新冠肺炎确诊病例27.8万例，死亡7159例。该国有限的医疗资源正承载巨大压力。据美国有线电视新闻网（CNN）4月3日报道，随着新冠病毒在全美国迅速蔓延，感染高峰仍未到来而医疗物资已经短缺，医院和医生将面临一个艰难抉择：选择谁能获得救命的呼吸机。“美国的医生从未遇到这种情况”，“这将（是）极其困难（的决定）”。哈佛医学院生物伦理中心主任罗伯特·特鲁格博士（Dr. Robert Truog）说到。纽约州州长科莫曾在4月2日指出，纽约州的呼吸机“正以火烧般速度”减少，呼吸机库存将在6天内耗尽。据康涅狄格州的一名医生表示，通常情况下成年患者只需在重症监护室（ICU）里靠呼吸机持续三到四天，但新冠肺炎患者使用呼吸机最多需要两到三周。随着新冠肺炎患者大量涌入医院，全国重症监护病房对呼吸机的需求也在激增。对此，特鲁格说他整个周末都在帮助医院制定政策，以决定什么人能在公共卫生紧急情况下能够接受重症监护。他说，一个更好的指导框架是由匹兹堡大学和匹兹堡大学医学中心的重症监护医学教授怀特博士（Douglas White）研发的。报道称，这个框架本质上是一个积分系统，基于两个因素：1）挽救最多的生命 ；2）挽救最多的寿命年数（life-years），以此来计算患者从ICU护理中获益的可能性，并由此来决定患者护理的优先级。当积分相同时，怀特的指导框架建议医生考虑患者的生命周期，优先考虑年轻患者。据此前报道，上述积分系统将重症患者分成了八个等级，分数越低，获得救治的机会越高，但如癌症晚期、失智症、慢性肺病等患者的分数较高，将意味着在物资短缺时他们将较难获得足够的医疗救治。有批评声音认为，上述积分制度在某些极端情况下将决定病人的生死。对此，怀特解释称，这一积分系统是比当前的呼吸机分配方案更公道的。怀特表示，他的积分系统旨在包容和避免歧视残疾人，“必须明确的是，没有人会因为残疾而丧失治疗资格”。他通过审查关于分配重症病患护理资源的现有建议，发现这些建议通常基于“排除标准”。“高龄、严重认知障碍、慢性心肺疾病”均被排除在救治范围内，“我认为这是不道德的。排除标准发出了错误的信息，即有些生命不值得被挽救。”例如，阿拉巴马州的2010年紧急行动计划称“患有严重的智力障碍”和“中度至重度痴呆”的人“不太可能获得呼吸机支持”。这些指南于2020年2月更新，但新指南没有提及在呼吸机短缺的情况下如何对患者进行分类治疗。阿拉巴马州公共卫生部尚未确认是否仍在使用“排除标准”。而怀特的指导框架确保了从一开始就没有人被取消获得重症监护的资格。哈佛大学的特鲁格博士最近在《新英格兰医学杂志》和《波士顿环球报》上发表文章支持了怀特的指导框架，认为这会帮助医院、医生和公众为（特鲁格博士认为）即将面临的决策做好准备。怀特认为专家的前瞻性很重要。这样一来，面对大流行，医生们就不用为这些可怕的伦理问题而苦苦挣扎。他还认为，分诊委员会（triage committee）应该由非一线的医生创立，以“增强客观性，避免冲突，并将道德痛苦降到最低”。特鲁格则表示即使有了像怀特提供的框架为伦理指导，但美国医生的未来之路并不平坦。 “很有可能，在未来几天里，医生们将不得不做出他们以前从未考虑过的决定。对一些人来说，这种精神上的打击将会使他们完全丧失能力。”（实习生张佳琳来自上海外国语大学多语种国际新闻班）
世界各地有超过100万人受,https://k.sina.com.cn/article_5975063980_m164243dac03300o5xm.html?from=ent&subch=oent,雒邑叔宽,2020-04-04,21:06:29,世界各地有超过100万人受新冠疫情影响而被迫呆在家中。可是他们通过各种方式来保持积极的心态面对疫情。有人在家中办起了音乐会，有人在阳台上跳起了舞，有人在小区里给过生日的邻居小孩唱生日快乐歌。虽然病毒很可怕，但是人们用音乐，舞蹈和笑声面对它。特别声明：以上文章内容仅代表作者本人观点，不代表新浪网观点或立场。如有关于作品内容、版权或其它问题请于作品发表后的30日内与新浪网联系。
全球最可靠疫情图每天点击量超10亿，由两名中国留美博士生操盘,https://t.cj.sina.com.cn/articles/view/5617046716/14ecd54bc00100o0wa?from=tech,中国新闻周刊,2020-04-04,21:05:06,（霍普金斯大学的全球疫情分布图（网站截屏））一张黑底、红点，左右两侧列着各国确诊、死亡和恢复病例的地图，成为近来一些国际新闻的背景图片。美国副总统彭斯去卫生部视察时，美国卫生部就用这张地图监测全国病例，意大利总理、德国内阁开会时，身后电子屏幕也正在依靠这张地图展示疫情实时情况。这个数据地图由美国约翰·霍普金斯大学系统科学与工程中心（CSSE）一年级博士生董恩盛等人发起并维护。最初，他只是想要通过追踪数据来观察一场疫情从生到死的整个过程，用这些数据作为他研究疾病的工具，如今，这个每日点击量超过10亿的网站，已经成为多国政府高层、公共卫生学者和主流媒体引用最多的疫情数据来源，更新和运营这个网站成了董恩盛的“主业”。“无心插柳”的网红数据项目1月21日寒假过后，在一次博士生组会上，董恩盛的导师、系统科学与工程中心副教授劳伦·加德纳和大家聊起新学期的计划，听说中国的新冠肺炎很严重，便问董要不要做个数据仪表板？董恩盛的研究方向是疾病模型，也就是用数学模型和计算机代码来解释一些流行病学、公共健康方面的问题，对全球流行病的发展趋势做基本的判断和推测。当时他已经在搜集数据准备做这个事情了，两人一拍即合，七八个小时后，第一版疫情可视化地图就做好了，1月22日，这个网站便正式面世了。去年5、6月份的时候，董恩盛与劳伦·加德纳便在另一个流行病风险性分析项目中做了一个类似的数据可视化地图，当时引来一些美国主流媒体的报道。所以，他说技术思路上是比较成熟的，很快就能调试上线；另一方面，由于他的中文优势，去中国国家卫健委上面抓取数据即可，所以早期团队在中国疫情上比全球其他一些数据来源更及时。（董恩盛（右）、杜鸿儒今年1月在美国参加学术会议。（图片来源twitter））起初几天，数据都靠他手动整理，每天最多能保持4～5次更新。2月1日之后，这种方式变得不可持续，于是项目转为半自动化更新：中国的疫情数据来自丁香园的自动更新，而其他国家的数据依然需要人工审核。为了发现各国新增病例，他们的监测渠道包括世界卫生组织（WHO）、推特、新闻报道、地方卫生部门提供的数据等等。这一阶段，另一个博士生杜鸿儒也加入到数据收集和图表的制作中来。到了3月初，这个数据小组将美国疫情信息具体到县一级层面。“因为美国郡县大概有3000多个，再加上世界上有200多个国家和地区，人工完成非常吃力。”董恩盛告诉《中国新闻周刊》，于是小组招募了一些志愿者，把人员分了很多组，有的组负责国外，有的组负责美国国内不同地区，然后24小时不间断地发布最新数据。2月19日，董恩盛、杜鸿儒与劳伦·加德纳发表在《柳叶刀》杂志上的文章介绍了这项工作。文章对比了约翰·霍普金斯大学系统科学与工程中心、WHO和中国疾控中心的数据报告。结果发现，他们的病例数据与后二者报告一致，而且他们在捕获新国家或地区中首次报告的COVID-19（新冠病毒）病例上更加及时。董恩盛说，WHO分为不同区域，各区域会及时更新数据，但是等到汇总到总部正式发布时，通常是第二天了——当然，也有极个别意外，尤其是最初全依赖人工操作时。有一个周六的早晨澳大利亚报告了首例确诊病例，但因为董恩盛当时在睡觉，就没有及时更新。这个过程中还有很多具体的困难。比如，2月中旬部分“钻石公主号”邮轮旅客撤回到美国。由于患者具体位置不明，他们就选择了将点标记在美国相对的地理中心——堪萨斯州。但有些美国人放大地图，最后发现这个点落在他们小区上，以为自己小区竟然有病例，便层层上报，后来学校让他们赶紧调整一下，于是标记点暂时放回了日本横滨港。如何统一好数据的定义也是个问题。虽然用户看到的是“确诊病例”“死亡人数”这些标签，但团队实际面对的却是各国甚至同一国家对于这些概念不同的定义。比如，董恩盛说，一开始美国CDC统计的“确诊病例”需要核酸检测呈阳性加上CDC认定才算确诊，但是他们采用“推定阳性病例”的估算，亦即确诊数据是指由州或地方实验室确认的病例，但未经CDC证实，因此数字要比CDC的大一些。可靠的数据是研究和决策的基础在线科技出版物Digital Trends3月28日发表文章《最可靠的新冠疫情仪表板》，其中提到六种可视化疫情数据通报平台，约翰·霍普金斯的这套系统获得最高评价。原因是该平台“可视化设计最好，导航明晰、阅读方便，且是六个平台中更新最频繁的。”美国疾控中心（CDC）也是其中一个平台。不过，该网站标注：该页面从周一中午至周五定期更新，显示的数据为截至前一天下午4时的统计结果。另外还有文字提示：CDC与各州和地方的公共卫生部门报告的病例存在差异，各州通报的病例为最新数据。董恩盛说，疫情早期CDC的数据精度比较低，它只是报告每个州病例数量范围。这样的运作模式使得CDC的数据可视化不如约翰·霍普金斯大学的这个数据项目受欢迎。在3月6日于华盛顿国会山举行的一场简介会上，劳伦·加德纳介绍，这个仪表板受到关注有一段时间了，现在平均每天点击量为10亿，最高峰一天点击达20亿。其间有过几次高峰，例如，当意大利疫情暴发时，许多意大利民众涌入网站，意大利用户数超过了美国。由牛津大学创立的“用数据看世界”网站解释，他们在监测全球各国新冠疫情数据时，最初参照3个数据源：世卫组织、欧洲疾病预防控制中心（ECDC）以及霍普金斯大学。目前他们已经放弃从世卫组织获取数据，一方面是因为世卫在3月18日修改了每日统计截止时间，另一方面在于其数据库曾出现过错误。“谁在使用这个仪表板？据我所知，几乎每个人都在使用。它几乎在所有的社交媒体渠道上走红，一直火到美国地方政府、州、联邦政府、公共卫生机构。”劳伦·加德纳说，这说明人们对于可靠的、值得信赖的、客观的信息有巨大需求，所以她认为，非常重要的是看到这种（需求与满足之间的）差距，并且支持这类数据可视化工具走向公众。约翰·霍普金斯大学是美国的一所研究性大学，也是全美最近连续33年来科研经费开支最高的大学，其公共卫生学院多年来排名全美第一。美国对外关系委员会全球卫生高级研究员黄严忠说，美国信息渠道很丰富，既有官方的CDC和各州公共卫生部门数据，也有民间机构、高校和媒体的数据更新，这样多元的数据渠道使得疫情更加透明。而约翰·霍普金斯大学的数据地图便是其中一个出色的例子。复旦大学公共卫生学院原院长、中华预防医学会新冠肺炎防控专家组成员姜庆五告诉《中国新闻周刊》，在疫情中，任何数据都要公开、透明，保证真实性，否则流行病学家、数学家无法做出判断，也就不能为决策提供可靠的指导。霍普金斯团队较高质量的数据成为诸多研究团队进行学术研究的基础，是科学界了解新冠疫情的重要信息来源。董恩盛说，每天他们都会在固定时间发布准确的数据，全世界的学者都可以看到，这方便学者们进行基于时间序列的疫情分析，“而时间序列分析在流行病学，尤其是对于疾病的预测方面有非常关键的作用。”现在，该数据地图的自动化程度越来越高了，而且学校也给予了很多技术和人力支持。接下来董恩盛希望配合他的导师，利用这些数据研究一下哪些地方比较容易受到新冠病毒的攻击，疫情什么时候会出现拐点等等。
