title,url,source,date,time,content
打赢战斗，我们有个重要优势,https://k.sina.com.cn/article_1645705403_621778bb02000nxex.html?from=news&subch=onews,国际在线,2020-04-04,20:39:25,　　本周，在疫情防控一刻不松的同时，中国正在紧张有序地复产复工。回看两个多月的战斗，感谢那些牺牲的战士们，感谢每一个奉献过的人。　　前几天，李兰娟院士谈了她对新冠病毒的新认识：非常顽固，传染性比其他病毒强。面对这样危险狡猾的“敌人”，中国能取得这么好的成绩，我们制度里的各种优势，起到了很关键的作用。　　这次，我们就来说说自己的一个重要优势——中国共产党的团结性、纪律性。　　党的纪律既是党的各级组织和全体党员必须遵守的行为规则，也是维护党的团结统一、完成党的任务的保证。　　1月底抗疫形势相当紧张的时候，张文宏大夫说过一句引起很多人共鸣的话：“一线岗位全部换上党员，没有讨价还价。”　　为什么党员不能讨价还价？为什么组织让我们上一线，就必须上一线？　　从党章党规党纪的角度来讲，这就是“组织纪律”。　　组织纪律，是中国共产党六大纪律（政治纪律、组织纪律、廉洁纪律、群众纪律、工作纪律、生活纪律）中很重要的一条。按照组织纪律的要求，只要你是党员，就要无条件服从党组织，坚决执行党组织的决定。　　而且，越是特殊时期和紧急情况，越要相信组织、服从组织，组织指向哪，党员就要冲向哪，不讲条件、不找借口。　　于是，共产党员是第一批冲上去的那一拨。上海第一批援鄂医疗队，近一半是党员。解放军早期援鄂医疗队的专家，更是清一色的党员。　　严格的组织性纪律性，确保了这支队伍的战斗力。全国上下，从医院到高速路口，哪里有党组织，哪里就组织起抗疫的坚强力量。当初军队医疗队刚抵达火神山医院，5个中心和3所军医大学的8支医疗队快速成立临时党委，下设34个临时党支部和党小组，加强对医疗救治工作的组织领导。　　有组织，就有力量。　　隔离期间，出不了门的你，很可能体验过社区党组织的全方位关心。　　他们每天组织人手帮我们买菜、带药，关注我们的健康状况，值守门岗，给小区公共环境消毒，宣传防疫政策……我们日常生活需求，事无巨细，他们不分白天黑夜地保障。　　武汉、北京一些老旧小区，没有物业，就靠大批党员干部下沉下去。　　很多地方的党组织，开设了群众热线，24小时受理诉求，帮群众解决问题。　　这些“服务”，不讲报偿、不讲条件、不讲得失。为什么我们的党组织可以做到这些？因为共产党从诞生之初，就有一个刻在基因里的宗旨——全心全意为人民服务。时刻维护群众的利益，提高群众工作本领，只要群众需要，就要毫无保留地付出，对于共产党员，这是“群众纪律”，是全心全意为人民和不拿群众一针一线的高度统一。　　以下节选自2月5日江苏泰兴一名村党支部书记的防疫日志：　　“凌晨0点2分，转发《关于疫情期间实施人员管控“十个从严”措施的通告》，通知副书记‘用粉红色纸打印发到每家每户’。”　　“8点5分，电话联系口罩供应商，协调360个医用口罩。”　　“12点5分开始，到各个卡口点再次巡查。”　　“23时40分，在两委干部议事群发布消息：“到了晚上尤其是深夜，要在封闭路口设置醒目的安全警示标识，确保交通道口的管控和安全。”　　这位村支书，拖着残腿，从深夜忙到深夜，带着村两委扛起了全村的防疫重任。　　在很多农村地区，驻村的党员工作队就地转化成抗疫先锋队。他们长期搞群众工作，相当有经验，分组包片区，组联到户、责任到人，对各村人员往来情况全覆盖排查，在村口24小时定点蹲守，劝返外来车辆人员，劝散扎堆闲聊、走村串户的村民，阻断病毒可能的传播渠道，把防疫责任落实到了极致。　　神经末梢的农村是如此，其他环节更是如此。全国的省、市、县各地区各部门，以及大大小小的企业党组织，都拉起专门力量，把防疫作为最重要的工作来抓。　　这种对责任的强烈看重、履职的积极态度，体现着对党的“工作纪律”的自觉认同、自觉遵从。只要城池交到我手上，就不能失守；只要任务分配到我肩上，就不能把它掉了。　　在党的工作纪律里，还有一项很关键的要求，那就是踏实的工作作风，不搞形式主义官僚主义，把更多精力投入到疫情防控第一线。　　最后，必须要说一个最基础、最重要的纪律：党的政治纪律。　　为什么党中央一声令下，疫情防控政策就能从省一级直插最基层，贯通到底？　　为什么960万平方公里土地，从武汉的小区到拉萨的车站，从东北平原的屯子到西南深山的村子，都能遵照执行严格的防疫措施？　　“一省包一市”仅仅启动2天，19个省的援鄂医疗队就全部到位，行动为何如此迅速一致？　　全国有400多万个党组织，统一意志、统一行动，全国一盘棋，怎么做到的？　　所有这些，源于党的创造力、凝聚力、战斗力，源于以伟大自我革命引领伟大社会革命的坚定不移，同时，也都有一个很重要的原因——我们党有严明的政治纪律。　　政治纪律，要求全党同党中央保持高度一致，党中央提倡的坚决响应，党中央决定的坚决执行，党中央禁止的坚决杜绝。　　政治纪律，如同一根贯穿全党上下的弦，只要各级党组织、党员干部把这根弦上紧了，大家自然而然就步调一致。　　说完这些现象背后的“纪律因素”，再来说说，我们有如此严明的纪律性，靠的是什么？　　——全面从严治党。　　党的十八大以来，我们全面从严治党，加强纪律建设，对党员严格要求，彻底扭转了组织涣散、纪律松弛的局面。这些年，遵守纪律、接受监督，已经成为全党上下的高度自觉。　　有备则无患。当2020年疫情突然来袭时，我们这个组织严密、纪律严明的庞大党员队伍，自然能够冲锋在前，自然来之能战，战之能胜。　　信仰保证了我们的人民立场，纪律保证了我们的战斗能力。信仰加纪律，就是“中国共产党为什么能”的答案之一。　　欲知下周大事，且听下回分解。（子不歇）特别声明：以上文章内容仅代表作者本人观点，不代表新浪网观点或立场。如有关于作品内容、版权或其它问题请于作品发表后的30日内与新浪网联系。
英国累计确诊近4万，仍不建议健康人戴口罩，有人坚持跑步…… | 每日影像,https://k.sina.com.cn/article_1050395697_3e9bc43101900ozzk.html?from=news&subch=onews,新华每日电讯,2020-04-04,20:37:43,来源：新华社伦敦4月3日电记者：张家伟、桂涛图片：新华社/路透英国卫生部3日发布的新冠肺炎疫情数据显示，与前一天相比，英国新增确诊病例4450例，累计病例数已达38168例；累计死亡病例数也攀升至3605例。尽管如此，英国卫生官员当天表示，仍不建议健康人士日常戴口罩。在当天的疫情发布会上，英格兰副首席医疗官乔纳森·范-塔姆说，没有证据显示健康民众日常戴口罩会阻止新冠病毒扩散，“我们不推荐公众日常戴口罩”。正在自我隔离的英国首相约翰逊3日在社交媒体上发文说，自己目前仍有轻微发热症状，但他表示，目前和团队仍在努力工作，与疫情战斗，并呼吁民众在即将到来的周末，抵制住好天气的诱惑，不要出门。2020年4月3日，在英国南希尔兹，一个户外大屏幕上显示向NHS（英国国民保健制度）医护人员致敬的话语。2020年4月3日，在英国伦敦，一名女子佩戴口罩出行。2020年4月3日，在英国南希尔兹，两辆公共巴士停在停车场内。2020年4月3日，在英国伦敦，一名路人骑车经过空荡荡的威斯敏斯特桥。2020年4月3日，在英国伦敦，一名男子佩戴口罩走过布里克斯顿车站。2020年4月3日，在英国伦敦首家用于收治新冠病例的临时医院，工作人员悬挂救护车停靠指示牌。2020年4月3日，在英国南希尔兹，一个窗户上贴着彩虹图案。2020年4月3日，在英国南希尔兹，一个户外电子屏幕上显示呼吁人们待在家中的话语。2020年4月3日，在英国南希尔兹，公共巴士停在车库内。2020年4月3日，在英国南希尔兹，一个户外大屏幕上显示向NHS（英国国民保健制度）医护人员致敬的话语。2020年4月3日，在英国伦敦首家用于收治新冠病例的临时医院，工作人员悬挂救护车路线指示牌。2020年4月3日，在英国伦敦首家用于收治新冠病例的临时医院，工作人员悬挂救护车停靠指示牌。2020年4月3日，人们在英国南希尔兹的海边遛狗。2020年4月3日，在英国伦敦，一名男子佩戴口罩走过布里克斯顿车站。2020年4月3日，在英国伦敦的一个公园内，一名女子佩戴口罩站在河边。2020年4月3日，在英国南希尔兹，一名行人走过空荡荡的社区。2020年4月3日，在英国南希尔兹，一名公交工作人员离开车站。2020年4月3日，在英国伦敦，一名男子佩戴防护面罩出行。2020年4月3日，在英国伦敦，一名女子佩戴口罩离开布里克斯顿车站。2020年4月3日，在英国南希尔兹，两辆公共巴士停在停车场内。特别声明：以上文章内容仅代表作者本人观点，不代表新浪网观点或立场。如有关于作品内容、版权或其它问题请于作品发表后的30日内与新浪网联系。
这个清明节，人们学会了网上扫墓,https://k.sina.com.cn/article_1931279877_731cfe0500100lfd9.html?from=tech,科技每日推送,2020-04-04,20:37:39,今天是全国哀悼日，致敬英雄烈士，缅怀同胞，希望未来一切安好。以往，提醒大家清明节要来的，是阴雨绵绵的天气、买不到的肉松馅青团、是日历上的三天假期。今年，10086连续发出来的短信，引起了我们的注意。以前清明节的相关短信，无非是提醒扫墓小心山火，文明祭祀，今年则是劝大家”居家追思，切勿聚集“。新型冠状病毒引起的全球瘟疫大流行，彻底改变了我们的生活，2020年的春节和情人节，仿佛不存在般地过去了。这个即将来临的清明节，传统的上山扫墓，拜祭先人似乎也不太现实了。其实，我们也可以在网上扫墓。网上墓园听过吗？线上祭祀试过吗？其实这并非什么新鲜玩意，在非常非常粗糙的网络2.0时代，网上墓园就已经真实存在着。搜索“纪念网”、“网上纪念堂”等关键字，能看到不少线上提供网上祭祀服务的网站。在老旧的Web页面里，我们能一眼看到复刻传统祭祀各种要素的墓园。比如，这是邓丽君的墓园，背后青山绿草，环境优美。被祭祀人的照片和生平简介必不可少，亲友的追思留言也一应俱全，还有最实在最具意味的传统做法----给先人烧东西。然而因为Chrome浏览器从2020年起不再支持Flash，所以看不到墓前的献花蜡烛。虽然网页制作有点粗制滥造，看着像上个世纪的产物，但是回头想想也是蛮环保的，一键就能上香、点烛、献花，还有各式各样的供品。如果我们相信祭品烧成灰，就能到达另一个世界，那么这种由数字比特构成的虚拟化物品，又怎么不能到达另一个彼岸？一年到头那么多个节日，人们心中更在意是仪式感。比起传统扫墓，真心诚意地点两下鼠标，仪式感实在太低了，低到让人觉得是智商税。对于这些网上墓园来说，留言功能可能是一种进步，还创新地能让你很快找到别人的墓。网上墓园很大一部分流量是名人的墓，有明星的也有英雄的，像是张国荣、科比、刘真等等，更有人为这次新冠病毒而死去的逝世者们制作了纪念园。只不过，几乎所有网上纪念网都开设了名人纪念馆。太多了，多到留言让人觉得不庄重，也缺少真情实感。纪念逝者这件事，充值是解决不了问题的。哀悼的本质并不是仅仅是有个地方供大家追思就完了。和谁一起，在什么地方，很重要很重要很重要。互联网越来越便利，足不出户，我们可以云养猫、云游戏、云恋爱。这次被迫宅家，让本来更依赖线下的活动，也以迅雷不及掩耳之势强行线上——社畜上身穿着衬衫下身穿着睡衣就开始网上会议，小孩在家里蹦蹦跳跳上体育课被楼下邻居投诉，中年危机的老父亲和朋友们在微信上视频云喝酒……除了发短信，不少地方的墓园也加速提供线上祭扫服务。来看一段新闻：广州市银河烈士陵园（银河革命公墓）推出烈士拜祭和公众拜祭等网络服务，市民可线上留言追思和献鲜花。其中，广东省民政厅会同广东省政务服务数据管理局借助微信政务小程序“粤省事”平台推出“云祭扫”服务；广州市民政局正统筹建设全市性的网上拜祭服务平台。划重点：银河公墓官网提供网上扫墓服务；“粤省事”小程序上线云祭扫服务；登陆广州市银河烈士陵园的网站，今年新增了类似上述网上墓园的网上拜祭服务，输入安放在银河革命公墓的先人姓名全程进入网络拜祭空间，同样可以装饰墓园、献花供品都是免费的，不需要充值。相比之下，“粤省事”小程序的“云祭扫”服务，更让人觉得踏实。在粤省事的云祭扫服务里，你可以创建一个先人纪念空间，只需要填写相关名字和日期即可。当然我们这里要提的是另外两项服务：现场祭扫预约和代理祭扫服务。现场祭扫预约，目前选择后会提示敬请期待。所谓代理祭扫服务，可以让工作人员帮远方的亲人到墓前献花，并同时传回照片。截止到3月底，这两项服务还没正式上线，相关的工作人员告诉我们，因为要连上全省大部分的墓园，所以需要一定时间。这样的互联网跑腿服务，既解决了大家远程祭扫的不方便，也对祭奠先人这样的清明传统给与足够的尊重。在生活全面数字化后，很多物理的东西就被代替了，例如数码照片代替相册、云笔记代替日记本等。这么一个网络与现实交叉的现状，或多或少直接地影响人们如何去纪念一个逝去的人。数字化时代，社交媒体逐渐成为我们生活的重心。事无大小，我们都倾向于Po在网上记录。逐渐地，很多人开始会微博上纪念公共事件中死去的人，像李文亮医生。更早以前，在白血病患者鲁若晴、因肿瘤而去世的漫画家熊顿的微博下，常年都会有人来这里点蜡烛聊生活，留下自己思念和思考。此外，也有人在微博纪念死去的亲友。有一次博主@凉了个蝉 分享误入其他人微博的经历，有几条评论令人动容：公开的社交网络上，展现着一个个平凡却独特的人生，也给大家提供一个适合悼念的公共空间，人们在这怀念亲友和纪念死去的人，时间带走的只有时间。死亡总是来得突然而残酷，那些无处安放的思念，也许化作网络上的碎碎念，才能安静下来。这个清明节，多了几许变化，不变的是对逝者的哀悼。在数字化的世界里，可以回看可以回放，但现实却没有倒放的按钮。
不惧,https://k.sina.com.cn/article_6441787935_m17ff5e21f00100xldt.html?from=sports,金锋说,2020-04-04,20:36:59,特别声明：以上文章内容仅代表作者本人观点，不代表新浪网观点或立场。如有关于作品内容、版权或其它问题请于作品发表后的30日内与新浪网联系。
中方大批物资抵达纽约，白宫发出一片欢呼，蓬佩奥本人略显失落,https://k.sina.com.cn/article_6496432400_18337b11000100ntr8.html?from=news,真宝君,2020-04-04,20:36:44,据俄罗斯媒体最新报道称，将有大批医疗物资运抵美国纽约，以此缓解美国面临的巨大医疗压力。为此白宫爆发出一阵欢呼。据媒体报道，一架从上海起飞的波音747商用飞机抵达肯尼迪机场，在这架运输机上，装有大批医疗物资，有1500万副医用外科手套，以及10万只N95口罩，还有200万只医用口罩，3万套防护服等等。而且据美国发言人介绍称，这仅是第一批物资，后续还有大量物资跟进。此前美国白宫向媒体表态称，今后不再插手中美两国合作的事情。并且点名批评蓬佩奥本人，称以后没有白宫的允许，蓬佩奥不准再擅自作出诋毁中国的事情，更不能在推特上发布对中方不当的言论。我们知道，此前蓬佩奥一直将新冠病毒称之为是中国病毒，武汉病毒，不仅引起中国的不满，就连其他国家也都指责美国没有道德底线。众所周知，纽约已经成为美国的重灾区，目前纽约死亡人数已经高达1000多人，州长科莫在媒体面前多次落泪，称纽约每17分钟就有一人死于新冠肺炎。由此可见疫情的严重程度。虽然纽约是全球第一大城市，但是医疗水平却很有限。尤其瞬间爆发出这么多病人，让纽约的医疗系统完全陷入了瘫痪状态。尤其最匮乏的医疗物资根本无法满足供应。医生被要求一个N95口罩重复使用5次。纽约呼吸机只有1000台，而缺口却高达30000台。纽约希望得到白宫的支援，然而白宫方面却表示无能为力，让他们自己想办法。事实证明，强大的美国却连一场疫情都抗击不了，还何谈战争。如今美国白宫已经做出维护中美合作的承诺，相信蓬佩奥本人已是气得脸色铁青，略显失落。因为这将意味着他此前所做的努力都将前功尽弃。其实美国早就应该意识到，其他国家对他们的帮助只能是杯水车薪，想要战胜疫情，他们只能依赖中国！特别声明：以上文章内容仅代表作者本人观点，不代表新浪网观点或立场。如有关于作品内容、版权或其它问题请于作品发表后的30日内与新浪网联系。
疫情防控中的每一个人，都是这个时代的英雄,https://k.sina.com.cn/article_6996408830_1a104b9fe00100srzy.html?from=news,科技行地下,2020-04-04,20:36:15,"春三月，寒冬去，百花开。荆楚疫减，民心渐定，云开雾散。忆逝者，医无私，警无畏，民齐心。八方来源，风月同天。艰难困苦，玉汝于成。多难兴邦，众志成城，此后百年，风调雨顺，国泰民安。——题记=""bjh-image-caption>2020年庚子新春，势必在中华民族历史上写下浓墨重彩的一笔。来势汹汹的新冠病毒，让乙亥深冬的寒意，停滞了很长时间；这场没有枪声的战役，对古老的中华民族来说，是前所未有的挑战。两个月的时间里，英雄的中国人民，在中国共产党的坚强领导下，愈挫愈勇，群策群力，终于取得了这场战役的初步胜利。随着各省市的确诊人数的逐步清零，按下暂停键的生活终于再次步上了正轨——工厂复工，市场营业，曾经空空如也的街道，也慢慢恢复了生机。胜利的初步取得，离不开中国共产党的坚强领导，离不开医护人员的勇敢逆行，离不开举国上下的万众一心，更离不开每一个坚守者的责任担当。基辛格在《论中国》中写道：“中国人总是被他们之中最勇敢的人保护得很好。” 疫情面前，全国人民同舟共济，齐心协力，从天涯海角到西北边陲，从繁华都市到田园乡村，从武汉三镇到全国各地，每一个默默奉献的人，都是这个时代真正的英雄，都是中华民族最勇敢的人！勇敢逆行的白衣天使，是真正的英雄。年迈的钟南山院士一马当先，再次踏上新征程，那满头白发既是沧桑岁月的见证，更是医者仁心的象征。龙魂不死，薪火相传。无数的白衣天使紧随前辈的脚步，或驰援武汉，或留守一线。明知山有虎，偏向虎山行。在疫情战斗的前沿阵地，他们与病毒赛跑，跟死神抢人，那些口罩留下的压痕，就是他们最美的勋章。胸怀祖国的爱国企业，是真正的英雄。国难当头显担当，共抗疫情皆争先。疫情期间，各大企业纷纷出手，为疫情防控做出了巨大贡献：捐助设备物资，助力疫情防控的物资供应；宣传防疫知识，提高全民防疫意识；开发软件应用，方便疫情期间居民生活……“战疫需要什么，我们就造什么。国家需要的，就是我们要做的。”这样的企业，才是人民需要的企业，才是国家需要的企业。=""bjh-image-caption>默默坚守的“守门员”们，是真正的英雄。武汉封城，小区封门，村庄封路，空无一人是对过去两个月最真实的描述。那些各地哨卡的执勤者们，作为疫情防控的“守门员”，感染风险本就比普通人大得多，可是他们不仅要忍受大自然风吹雨打，还要承受不理解者的责难。，可是因为职责，因为使命，他们必须一直坚守。这场战役胜利的军功章上，一定有他们的名字。疫情期间，宅在家中的每一个人，也是真正的英雄。整个两个月，为了防止疫情扩散，全国人民居家隔离，不到万不得已绝不外出。国家有难，我不添乱，没办法冲锋在前，却可以稳定后方。这个春节，大家足不出户，大门紧闭，不走亲戚不拜年，不访四邻不聚餐。大家放弃传统习俗，改变生活方式，克服各种困难，为疫情防控争取了宝贵的缓冲时间，这样人民，就是英雄的人民。……武汉的樱花已经盛开，热干面再次飘香，工厂的机器开始轰鸣，陌上繁花似锦，春天已然归来，但我们要记住，从来没有什么岁月静好，只是因为有人替我们负重前行。时光不问赶路人，英雄不问出处，每个在平凡岗位上踏踏实实工作，每个为了疫情防控默默奉献的人，都是这个时代真正的英雄致敬英雄！致敬英雄的武汉！致敬英雄的中华民族！=""bjh-image-caption>特别声明：以上文章内容仅代表作者本人观点，不代表新浪网观点或立场。如有关于作品内容、版权或其它问题请于作品发表后的30日内与新浪网联系。"
火箭又1人力挺保罗，之前他是历史前五控卫，球迷：不给威少面子,https://k.sina.com.cn/article_7240701246_1af94553e00100pn0z.html?from=sports&subch=nba,有魔气历史小森,2020-04-04,20:35:31,现在，NBA依然处于停赛阶段，所有球员也都待在家中隔离，他们也逐渐意识到了疫情的严重性，因为之前已经有好几位NBA球员感染了新冠病毒，包括知名巨星杜兰特。然而在停赛期间，火箭队内有1人的表态引起了外界很大的热议，那就是小里弗斯的表态。他在个人媒体上谈到了保罗本赛季的出色表现，并且给出了很高的评价，身为火箭球员的他，一番言论倒是让威少非常尴尬。近日，小里弗斯在个人媒体上发文表示：保罗是历史前五的控卫球员。本赛季，保罗一个人率领着一支鱼腩球队打进了西部前八，甚至是在战绩上超越了休斯顿火箭。雷霆队内除了保罗之外，没有一位全明星级别的球员，所以那是让很多人感到不可思议的一点。小里弗斯也是继续补充到：他就是历史的传奇，虽然有很多人说他不行，但就自己看来他是最好的球员之一。众所周知，小里弗斯之前跟保罗当过一段时间的队友，但之后快船送走了队内几位主力，球队也步入了重建阶段。保罗曾在离队之后，发表感言：在快船打球不开心。小李也认为快船在那段时间是有机会打进总决赛的，但是球队最终还是输给了交易，如果队内那些球员没有离队的话，那么快船是可以打进总决赛的，而且他也解释到：自己跟保罗的关系很好，他是自己的好哥们。就小里弗斯的表态来看，他是特别尊敬保罗的，然而在这个阶段发表这样的言论，倒是让很多人觉得不太合适。首先，火箭送走保罗这件事情，其实伤害了两者之间的情感。保罗如今也是通过自己的实力打脸了火箭，证明他们做了一件错误的决定，小里弗斯此时去点赞保罗，难道不是在打击球队，以及贬低了威少吗特别声明：以上文章内容仅代表作者本人观点，不代表新浪网观点或立场。如有关于作品内容、版权或其它问题请于作品发表后的30日内与新浪网联系。
